{"cert_sha256":"sha256:804c9acae5f53ff8c33b72ea9e8d5ab7cdc5b09a818eb207839f0b2ce054d440","firev_accept":true,"holder_delta":0,"instance_hash":"sha256:4a1a90cf480e076e1ee668a2f5ba1f3d110e5f05f5aea3f6defd916107c436b5","ir_hash":"sha256:1d2740320070d63cc487bbc9333d10ca0d6c43e102ac1940bc4daa517a0492ba","kernel_eval_receipt_sha256":"sha256:eb3ad349eb9c286433245faa8567d45ac35ac5bfc3bd7946357ba4aa72479a25","kernel_ir_hash":"sha256:1d2740320070d63cc487bbc9333d10ca0d6c43e102ac1940bc4daa517a0492ba","kernel_model_id":"fire_fee_note_v1","kernel_receipt_sha256":"sha256:88879b6670bda673decf825040ae168759597389314ff3c6986a2ce0b8d1bf66","object_family":"capped_index_note","object_hash":"sha256:5dda1237873fa880e49b26cf62797f542b3cb195b434c12b35b70b8a59be023f","object_id":"fee_note_v1","object_name":"FeeNote","object_version":"v1","payoff_out":0,"replay_input_sha256":"sha256:88f385810b9190f4926dc39752a89877e3e44d8fbf7f1554d21d4862556bc7d2","schema":"zenodex/fire-kernel-settlement-receipt/v1","settlement_command_args":{"holder_posted_in":0,"witness_final_in":0,"writer_posted_in":77},"settlement_command_tag":"firev_accept_and_settle","settlement_effects":{"compiled_upper":77,"firev_accept":true,"payoff_out":0},"settlement_state":{"artifact_lower":0,"artifact_upper":77,"cap_index":7,"holder_delta":0,"holder_posted":0,"n_notional":11,"phase":"Settled","source_upper":12,"witness_final":0,"writer_delta":0,"writer_posted":77},"writer_delta":0}